{
  "schema": "org.knulli.app-store/package-manifest/v1",
  "id": "io.github.unitreign.playtime",
  "name": "PlayTime",
  "version": "1.0.0",
  "type": "utility",
  "summary": "Tracks game play time on Knulli.",
  "repository": "https://github.com/unitreign/playtime",
  "license": "GPL-3.0-only",
  "review": {
    "status": "experimental",
    "approval": {
      "provenance": "community"
    },
    "notes": [
      "User-authorized experimental installation on any Knulli device with matching aarch64 glibc and declared SDL libraries. Device lists and display bounds are advisory; exact-device evidence controls the tested badge.",
      "Real-device validation is limited to PlayTime 1.0.0 on TrimUI Smart Pro with Knulli Scarab. The tester reported only that the test was all good; individual lifecycle steps were not reported.",
      "MagicX testing is authorized from confirmed Knulli, aarch64, 640x480, and SDL GameController runtime facts; package install and launch remain untested.",
      "The manager restores execute permission only for the reviewed playtime binary and playtime.sh launcher.",
      "PlayTime statistics remain outside the managed package directory under /userdata/system/configs/playtime.",
      "The tagged UI derives its layout from the display size and falls back to 640x480. Accelerated SDL rendering and the MagicX controller remain real-device test requirements."
    ],
    "evidence": [
      {
        "kind": "repository",
        "url": "https://github.com/unitreign/playtime"
      },
      {
        "kind": "release-asset",
        "url": "https://github.com/unitreign/playtime/releases/download/v1.0.0/PlayTime.zip",
        "note": "Version-pinned ZIP; 1,569,588 bytes compressed, 3,066,702 bytes across extracted regular files, SHA-256 7bc7480400693be09b841f3a0612a8d85cefec549a3f6e5d0edee3a73c80aed3."
      },
      {
        "kind": "license",
        "url": "https://github.com/unitreign/playtime/blob/5f60c2090e0c456bfbf343d9d3b9c76f2a327135/LICENSE",
        "note": "GPL-3.0-only license reviewed at the tagged commit."
      },
      {
        "kind": "compatibility-claim",
        "url": "https://github.com/unitreign/playtime/blob/5f60c2090e0c456bfbf343d9d3b9c76f2a327135/README.md",
        "note": "The release is Knulli-specific and ARM64, but this revision does not identify TrimUI Smart Pro or a minimum Knulli version."
      },
      {
        "kind": "filesystem-and-network-review",
        "url": "https://github.com/unitreign/playtime/blob/5f60c2090e0c456bfbf343d9d3b9c76f2a327135/main.go",
        "note": "Reviewed paths are /userdata/roms/tools/PlayTime, /userdata/roms/tools/gamelist.xml, /userdata/system/configs/playtime, and /userdata/system/scripts/playtime-hook.sh. The tagged launcher and binary use local files and do not download or execute remote code."
      },
      {
        "kind": "magicx-experimental-review",
        "url": "https://github.com/unitreign/playtime/blob/5f60c2090e0c456bfbf343d9d3b9c76f2a327135/internal/ui/ui.go",
        "note": "The tagged code uses runtime display dimensions with a 640x480 fallback and SDL GameController actions. MagicX accelerated rendering and controller behavior are not yet package-tested."
      },
      {
        "kind": "real-device-test",
        "url": "https://github.com/jellydn/knulli-app-store/blob/main/docs/real-device-tests.md",
        "note": "Tester reported 'Tested Grout and Playtime. All good.' The report did not itemize lifecycle steps and does not cover MagicX Zero 28.",
        "tester": "Dung Huynh Duc",
        "date": "2026-09-15",
        "package_version": "1.0.0",
        "firmware": "knulli",
        "architecture": "aarch64",
        "device": "trimui-smart-pro",
        "resolution": "1280x720",
        "result": "passed"
      }
    ]
  },
  "release": {
    "url": "https://github.com/unitreign/playtime/releases/download/v1.0.0/PlayTime.zip",
    "sha256": "7bc7480400693be09b841f3a0612a8d85cefec549a3f6e5d0edee3a73c80aed3",
    "size": 1569588,
    "installed_size": 3066702,
    "format": "zip",
    "immutable": true
  },
  "compatibility": {
    "firmware": "knulli",
    "architectures": ["aarch64"],
    "abis": ["linux-aarch64-glibc"],
    "minimum_glibc": "2.34",
    "dependencies": ["sdl2", "sdl2-image", "sdl2-ttf", "libc"],
    "device_scope": "any",
    "display_bounds": {
      "minimum_width": 640,
      "minimum_height": 480,
      "maximum_width": 1280,
      "maximum_height": 720
    }
  },
  "install": {
    "destination": "/userdata/roms/tools/PlayTime",
    "strip_components": 1,
    "launcher": "playtime.sh",
    "executables": ["playtime", "playtime.sh"],
    "warning": "Unverified experimental test on this device. Existing files are backed up. Statistics stay under /userdata/system.",
    "menu": {
      "gamelist": "/userdata/roms/tools/gamelist.xml",
      "path": "./PlayTime/playtime.sh",
      "name": "PlayTime",
      "description": "Track game play time and view your play statistics on Knulli.",
      "image": "./PlayTime/icons/playtime.png"
    },
    "network": false,
    "allowed_write_paths": [
      "/userdata/roms/tools/PlayTime",
      "/userdata/roms/tools/gamelist.xml",
      "/userdata/system/configs/playtime",
      "/userdata/system/scripts/playtime-hook.sh"
    ]
  }
}
